{
  "$schema": "../../schema/model.schema.json",
  "id": "example-crane",
  "names": {
    "fa": "درنای سنتی",
    "en": "Traditional crane"
  },
  "category": "bird",
  "difficulty": 2,
  "designer": "Traditional",
  "source": {
    "book": "Rabbit Ear test file crane-sequence.fold (placeholder until the Komatsu pipeline exists)",
    "page": 1
  },
  "paper": {
    "shape": "square",
    "sizeCm": 15
  },
  "stepCount": 37,
  "has3D": true,
  "fold3D": "crane.fold",
  "steps": [
    {
      "index": 1,
      "image": "steps/001.svg",
      "foldFrame": 0,
      "text": {
        "fa": "کاغذ مربع را با رو به پایین بگذارید.",
        "en": "Start with a square, white side up."
      }
    },
    {
      "index": 2,
      "image": "steps/002.svg",
      "foldFrame": 1,
      "text": {
        "fa": "از قطر تا بزنید و باز کنید.",
        "en": "Valley-fold along the diagonal and unfold."
      }
    },
    {
      "index": 3,
      "image": "steps/003.svg",
      "foldFrame": 2
    },
    {
      "index": 4,
      "image": "steps/004.svg",
      "foldFrame": 3
    },
    {
      "index": 5,
      "image": "steps/005.svg",
      "foldFrame": 4
    },
    {
      "index": 6,
      "image": "steps/006.svg",
      "foldFrame": 5
    },
    {
      "index": 7,
      "image": "steps/007.svg",
      "foldFrame": 6
    },
    {
      "index": 8,
      "image": "steps/008.svg",
      "foldFrame": 7
    },
    {
      "index": 9,
      "image": "steps/009.svg",
      "foldFrame": 8
    },
    {
      "index": 10,
      "image": "steps/010.svg",
      "foldFrame": 9
    },
    {
      "index": 11,
      "image": "steps/011.svg",
      "foldFrame": 10
    },
    {
      "index": 12,
      "image": "steps/012.svg",
      "foldFrame": 11
    },
    {
      "index": 13,
      "image": "steps/013.svg",
      "foldFrame": 12
    },
    {
      "index": 14,
      "image": "steps/014.svg",
      "foldFrame": 13
    },
    {
      "index": 15,
      "image": "steps/015.svg",
      "foldFrame": 14
    },
    {
      "index": 16,
      "image": "steps/016.svg",
      "foldFrame": 15
    },
    {
      "index": 17,
      "image": "steps/017.svg",
      "foldFrame": 16
    },
    {
      "index": 18,
      "image": "steps/018.svg",
      "foldFrame": 17
    },
    {
      "index": 19,
      "image": "steps/019.svg",
      "foldFrame": 18
    },
    {
      "index": 20,
      "image": "steps/020.svg",
      "foldFrame": 19
    },
    {
      "index": 21,
      "image": "steps/021.svg",
      "foldFrame": 20
    },
    {
      "index": 22,
      "image": "steps/022.svg",
      "foldFrame": 21
    },
    {
      "index": 23,
      "image": "steps/023.svg",
      "foldFrame": 22
    },
    {
      "index": 24,
      "image": "steps/024.svg",
      "foldFrame": 23
    },
    {
      "index": 25,
      "image": "steps/025.svg",
      "foldFrame": 24
    },
    {
      "index": 26,
      "image": "steps/026.svg",
      "foldFrame": 25
    },
    {
      "index": 27,
      "image": "steps/027.svg",
      "foldFrame": 26
    },
    {
      "index": 28,
      "image": "steps/028.svg",
      "foldFrame": 27
    },
    {
      "index": 29,
      "image": "steps/029.svg",
      "foldFrame": 28
    },
    {
      "index": 30,
      "image": "steps/030.svg",
      "foldFrame": 29
    },
    {
      "index": 31,
      "image": "steps/031.svg",
      "foldFrame": 30
    },
    {
      "index": 32,
      "image": "steps/032.svg",
      "foldFrame": 31
    },
    {
      "index": 33,
      "image": "steps/033.svg",
      "foldFrame": 32
    },
    {
      "index": 34,
      "image": "steps/034.svg",
      "foldFrame": 33
    },
    {
      "index": 35,
      "image": "steps/035.svg",
      "foldFrame": 34
    },
    {
      "index": 36,
      "image": "steps/036.svg",
      "foldFrame": 35
    },
    {
      "index": 37,
      "image": "steps/037.svg",
      "foldFrame": 36,
      "text": {
        "fa": "درنا آماده است.",
        "en": "The crane is finished."
      },
      "notes": "Example data only: frames come from Rabbit Ear's crane-sequence.fold (author: Kraft)."
    }
  ]
}